{
  "title": "Uber Eats",
  "icon": "",
  "messages": {
    "en": {
      "viewBlocks": {}
    }
  },
  "viewBlocks": [
    {
      "showTable": false,
      "id": "combined_data_pipeline",
      "customPipeline": "combined_data_pipeline",
      "files": ["DriverOnlineOffline", "DriverPayments", "CourierLifetimeTripData"],
      "visualization": "uberEats/Overview.vue",
      "title": "Overview",
      "text": ""
    },
    {
      "showTable": false,
      "id": "csv_courier_trips",
      "customPipeline": "csv_courier_trips",
      "files": ["CourierLifetimeTripData"],
      "visualization": "uberEats/MyRoutes.vue",
      "title": "My Routes",
      "text": ""
    },
    {
      "showTable": false,
      "id": "earnings",
      "customPipeline": "combined_data_pipeline",
      "files": ["DriverOnlineOffline", "DriverPayments", "CourierLifetimeTripData"],
      "visualization": "uberEats/Earnings.vue",
      "title": "Earnings",
      "text": ""
    }
  ],
  "dataSamples": [
    "https://raw.githubusercontent.com/hestiaAI/hestialabs-experiences/master/packages/lib/data-samples/uber-eats-sample.zip"
  ],
  "dataPortal": "https://myprivacy.uber.com/privacy/exploreyourdata/download",
  "version": 1
}
