{
  "title": "Uber Eats",
  "icon": "https://raw.githubusercontent.com/hestiaAI/hestialabs-experiences/master/packages/lib/icons/ubereats.png",
  "credits": "Developed by Serhii Moshtakov and Fabian Studer, students at <a href=\"https://www.fhnw.ch\" target=\"_blank\" rel=\"noopener noreferrer\">FHNW University of Applied Sciences and Arts Northwestern Switzerland</a>, with Prof. Anton Fedosov. Improved under the SPARK project “Participatory Methodology for AI Accountability in the Gig Economy” (Principal Investigator: Jessica Pidoux, University of Neuchâtel).",
  "messages": {
    "en": {
      "viewBlocks": {}
    },
    "fr": {
      "intro": {
        "credits": "Développée par Serhii Moshtakov et Fabian Studer, étudiants de la <a href=\"https://www.fhnw.ch\" target=\"_blank\" rel=\"noopener noreferrer\">Haute école spécialisée du Nord-Ouest de la Suisse (FHNW)</a>, avec le Prof. Anton Fedosov. Améliorée dans le cadre du projet SPARK « Participatory Methodology for AI Accountability in the Gig Economy » (requérante principale : Jessica Pidoux, Université de Neuchâtel)."
      },
      "viewBlocks": {
        "trips_by_weekday_hour": {
          "title": "Quand vous travaillez",
          "text": "Quand vous acceptez des commandes : chaque case compte les courses terminées acceptées ce jour de la semaine et à cette heure (heure locale). Par défaut, elle montre la moyenne par semaine active, c'est-à-dire par semaine (du lundi au dimanche) comptant au moins une course terminée, pour pouvoir comparer des périodes de durées différentes. Choisissez « Total » pour le nombre sur toute la période de l'export.",
          "vizProps": {
            "messages": {
              "title": "Courses terminées par jour et heure",
              "perActiveWeek": "Par semaine active",
              "total": "Total",
              "perActiveWeekHelp": "Nombre moyen de courses terminées acceptées à chaque heure, par semaine comptant au moins une course terminée.",
              "totalHelp": "Nombre de courses terminées acceptées à chaque heure, sur toute la période de l'export.",
              "completedTrips": "Courses terminées",
              "activeWeeks": "Semaines actives",
              "busiest": "Heure la plus chargée",
              "noData": "Aucune course terminée dans cet export."
            }
          }
        },
        "trips_per_hour": {
          "title": "Courses par heure",
          "text": "Le nombre de courses par heure (TPH, « trips per hour ») est la mesure que certains opérateurs de flotte utilisent pour évaluer la performance d'un coursier. Votre temps en ligne comporte trois phases : P1, l'attente d'une commande (open) ; P2, le trajet vers le restaurant (en route) ; P3, la livraison (on trip). Le TPH en ligne divise vos courses terminées par votre temps en ligne (P1 + P2 + P3), attente comprise. Le TPH actif les divise par le temps passé à traiter des commandes (P2 + P3), c'est-à-dire le temps de travail selon Uber. Les courses sont comptées au moment où vous les avez acceptées ; le temps est réparti entre mois et semaines (les semaines commencent le lundi).",
          "vizProps": {
            "messages": {
              "title": "Courses terminées par heure",
              "month": "Mois",
              "week": "Semaine",
              "tphOnline": "TPH en ligne",
              "tphActive": "TPH actif",
              "trips": "Courses terminées",
              "noData": "Aucun temps en ligne ni course terminée dans cet export."
            }
          }
        },
        "service_revenues": {
          "title": "Revenus dans le temps",
          "text": "Revenus de service par mois ou par semaine, d'après les paiements de votre export, datés au moment où Uber les a enregistrés. Le revenu de base correspond aux tarifs de livraison (prise en charge, distance, dépôt, réductions groupées et ajustements) ; les pourboires s'y ajoutent. La TVA est présentée à part : elle est perçue pour les autorités fiscales et n'est pas ajoutée aux barres.",
          "vizProps": {
            "messages": {
              "title": "Revenus de service dans le temps",
              "month": "Mois",
              "week": "Semaine",
              "base": "Revenu de base",
              "tips": "Pourboires",
              "vat": "TVA (non incluse)",
              "other": "Autres éléments",
              "noData": "Aucun paiement dans cet export.",
              "vatNote": "Les barres montrent le revenu de base et les pourboires, ainsi que les autres éléments (frais, ajustements) s'il y en a. La TVA est perçue pour les autorités fiscales : elle est présentée à part et n'est pas ajoutée."
            }
          }
        },
        "earnings": {
          "title": "Revenus de service",
          "text": "Ce qu'Uber a payé pour vos services, par jour, semaine ou année. Il s'agit de paiements pour des services, pas forcément de ce que vous gagnez : si vous êtes employé·e par un intermédiaire (un opérateur de flotte), votre fiche de paie peut être différente."
        }
      }
    }
  },
  "viewBlocks": [
    {
      "showTable": false,
      "id": "combined_data_pipeline",
      "customPipeline": "combined_data_pipeline",
      "files": ["DriverOnlineOffline", "DriverPayments", "CourierLifetimeTripData"],
      "visualization": "uberEats/Overview.vue",
      "title": "Overview",
      "text": ""
    },
    {
      "showTable": false,
      "id": "csv_courier_trips",
      "customPipeline": "csv_courier_trips",
      "files": ["CourierLifetimeTripData"],
      "visualization": "uberEats/MyTrips.vue",
      "title": "My Trips",
      "text": ""
    },
    {
      "showTable": false,
      "id": "trips_by_weekday_hour",
      "customPipeline": "trips_by_weekday_hour",
      "files": ["CourierLifetimeTripData"],
      "visualization": "uberEats/TripsHeatmap.vue",
      "title": "When you work",
      "text": "When you accept orders: each cell counts the completed trips accepted on that weekday and hour (local time). By default it shows the average per active week, meaning per week (Monday to Sunday) with at least one completed trip, so periods of different lengths can be compared. Switch to Total for the number over the whole export."
    },
    {
      "showTable": false,
      "id": "trips_per_hour",
      "customPipeline": "trips_per_hour",
      "files": ["DriverOnlineOffline", "CourierLifetimeTripData"],
      "visualization": "uberEats/TripsPerHour.vue",
      "title": "Trips per hour",
      "text": "Trips per hour (TPH) is how some fleet operators measure a courier's performance. Your online time has three phases: P1, waiting for an order (open); P2, going to the restaurant (en route); P3, delivering (on trip). TPH online divides your completed trips by your time online (P1 + P2 + P3), including waiting. TPH active divides them by the time spent handling orders (P2 + P3), which is the working time according to Uber. Trips are counted when you accepted them; time is split at month and week boundaries (weeks start on Monday)."
    },
    {
      "showTable": false,
      "id": "earnings",
      "customPipeline": "combined_data_pipeline",
      "files": ["DriverOnlineOffline", "DriverPayments", "CourierLifetimeTripData"],
      "visualization": "uberEats/ServiceRevenues.vue",
      "title": "Service revenues",
      "text": "What Uber paid for your services, per day, week or year. These are payments for services, not necessarily what you earn: if you are employed by an intermediary (a fleet operator), your payslip may differ."
    },
    {
      "showTable": false,
      "id": "service_revenues",
      "customPipeline": "service_revenues",
      "files": ["DriverPayments"],
      "visualization": "uberEats/ServiceRevenuesOverTime.vue",
      "title": "Revenues over time",
      "text": "Service revenues by month or by week, from the payments in your export, dated when Uber recorded them. Base revenue is the delivery fares (pickup, distance, drop-off, batch discounts and adjustments); tips are shown on top. VAT is shown apart: it is collected for the tax authorities and not added to the bars."
    }
  ],
  "dataSamples": [
    "https://raw.githubusercontent.com/hestiaAI/hestialabs-experiences/master/packages/lib/data-samples/uber-eats-sample.zip?contenthash=0631c1595fef379b2cfba284d4a74ab597f61923bcc3a585048e6928b5e4b314&filename=uber-eats-sample.zip"
  ],
  "dataPortal": "https://myprivacy.uber.com/privacy/exploreyourdata/download",
  "version": 1
}
